{"agentProcessesPerProfile":{"role-separated-margin-only-v1":2,"single-agent-margin-v1":1},"benchmarkVersion":"0.2.0-crossover","candidateID":"margin-0.3.2-structured-manual-v17","challengeCatalogSha256":"4c6b8e76e5a8cfc2c5d953814093540f2e4d8cb787b922f6792b98ba8ada1e1f","developmentCases":true,"episodeCount":1,"episodes":[{"demand":{"continuity":1,"coupling":0,"informationDistribution":2,"parallelism":4,"reviewIndependence":2,"specialization":1,"workspaceVolatility":0},"family":"clean-parallelism","fingerprint":"1fe63b51c305211c00fbb9e4ab1bc1bde29f8d998ffdf1c4a2ddd1cb26e33297","hypothesis":"role-separated-favored","id":"parallel_shards:0:1fe63b51c305","profileOrder":["role-separated-margin-only-v1","single-agent-margin-v1"],"repetition":0,"roles":["author","reviewer"],"scenario":"parallel_shards"}],"logicalRoleRunsPerProfile":2,"minimumPairsForDirectionalClaim":20,"profiles":["role-separated-margin-only-v1","single-agent-margin-v1"],"repetitions":1,"rules":{"budgetUnit":"logical-role","meaningfulSpeedRatio":1.2,"qualityTolerancePoints":2.0,"singleAggregateScore":false},"sampleSizeSufficient":false,"scenarioIDs":["parallel_shards"],"schema":"urn:marginbench:crossover-plan:v1","taskSet":"public-development-v1"}
