{"agentProcessesPerProfile":{"role-separated-margin-only-v1":17,"single-agent-margin-v1":9},"benchmarkVersion":"0.2.0-crossover","candidateID":"margin-0.3.2-structured-manual-v17","challengeCatalogSha256":"4c6b8e76e5a8cfc2c5d953814093540f2e4d8cb787b922f6792b98ba8ada1e1f","developmentCases":true,"episodeCount":9,"episodes":[{"demand":{"continuity":2,"coupling":4,"informationDistribution":2,"parallelism":0,"reviewIndependence":4,"specialization":3,"workspaceVolatility":3},"family":"review-and-decision","fingerprint":"2accc247aebecff868199d564896f7f574d967b0c5b30e49618019f8ce381dfc","hypothesis":"role-separated-favored","id":"suggestion_decision:0:2accc247aebe","profileOrder":["single-agent-margin-v1","role-separated-margin-only-v1"],"repetition":0,"roles":["author","reviewer"],"scenario":"suggestion_decision"},{"demand":{"continuity":4,"coupling":2,"informationDistribution":4,"parallelism":1,"reviewIndependence":1,"specialization":2,"workspaceVolatility":0},"family":"necessary-information-transfer","fingerprint":"d880973394fa66a42751def489a44ae667ed1bf2df39f979b6ce1b193ca9a479","hypothesis":"role-separated-favored","id":"distributed_synthesis:0:d880973394fa","profileOrder":["role-separated-margin-only-v1","single-agent-margin-v1"],"repetition":0,"roles":["author","reviewer"],"scenario":"distributed_synthesis"},{"demand":{"continuity":4,"coupling":3,"informationDistribution":4,"parallelism":1,"reviewIndependence":2,"specialization":2,"workspaceVolatility":1},"family":"distributed-workspace","fingerprint":"3b9f1593fa6a6347148ebcf4fc20e4570519c18781722e6990e12fe2f7c22b5f","hypothesis":"role-separated-favored","id":"directory_handoff:0:3b9f1593fa6a","profileOrder":["single-agent-margin-v1","role-separated-margin-only-v1"],"repetition":0,"roles":["author","reviewer"],"scenario":"directory_handoff"},{"demand":{"continuity":2,"coupling":1,"informationDistribution":1,"parallelism":0,"reviewIndependence":2,"specialization":1,"workspaceVolatility":0},"family":"human-boundary","fingerprint":"815198a62d06eec81753fc13dd7c910e14e5da15f57ee46f5a5a83f21c148cd3","hypothesis":"conditional","id":"human_agent_relay:0:815198a62d06","profileOrder":["role-separated-margin-only-v1","single-agent-margin-v1"],"repetition":0,"roles":["reviewer"],"scenario":"human_agent_relay"},{"demand":{"continuity":1,"coupling":0,"informationDistribution":2,"parallelism":4,"reviewIndependence":2,"specialization":1,"workspaceVolatility":0},"family":"clean-parallelism","fingerprint":"1fe63b51c305211c00fbb9e4ab1bc1bde29f8d998ffdf1c4a2ddd1cb26e33297","hypothesis":"role-separated-favored","id":"parallel_shards:0:1fe63b51c305","profileOrder":["role-separated-margin-only-v1","single-agent-margin-v1"],"repetition":0,"roles":["author","reviewer"],"scenario":"parallel_shards"},{"demand":{"continuity":2,"coupling":3,"informationDistribution":3,"parallelism":0,"reviewIndependence":4,"specialization":4,"workspaceVolatility":1},"family":"specialist-independent-review","fingerprint":"0585d0a6ef74e198ccc093b3b6b53fb6826ddab85dbc5d138e48c2454b08b2cc","hypothesis":"role-separated-favored","id":"specialist_audit:0:0585d0a6ef74","profileOrder":["single-agent-margin-v1","role-separated-margin-only-v1"],"repetition":0,"roles":["author","reviewer"],"scenario":"specialist_audit"},{"demand":{"continuity":3,"coupling":1,"informationDistribution":1,"parallelism":0,"reviewIndependence":0,"specialization":0,"workspaceVolatility":0},"family":"negative-control","fingerprint":"e80ad467c17039f6900c3e685c1d6690dea30fdfe7153c0afc0718b1ec8ca0cb","hypothesis":"continuing-favored","id":"agent_agent_handoff:0:e80ad467c170","profileOrder":["single-agent-margin-v1","role-separated-margin-only-v1"],"repetition":0,"roles":["author","reviewer"],"scenario":"agent_agent_handoff"},{"demand":{"continuity":1,"coupling":4,"informationDistribution":2,"parallelism":4,"reviewIndependence":3,"specialization":1,"workspaceVolatility":4},"family":"parallel-shared-state","fingerprint":"9117b49e318eccfb03a225cd3c3e225fb4080418b78384e4301317fc03af0113","hypothesis":"conditional","id":"concurrent_review:0:9117b49e318e","profileOrder":["role-separated-margin-only-v1","single-agent-margin-v1"],"repetition":0,"roles":["author","reviewer"],"scenario":"concurrent_review"},{"demand":{"continuity":3,"coupling":4,"informationDistribution":2,"parallelism":3,"reviewIndependence":2,"specialization":2,"workspaceVolatility":4},"family":"atomic-workspace-change","fingerprint":"00a47f179db6cf46601030ae44d931c673d30d883dc9a2c42faf4fe944dcecab","hypothesis":"conditional","id":"staged_multifile:0:00a47f179db6","profileOrder":["role-separated-margin-only-v1","single-agent-margin-v1"],"repetition":0,"roles":["author","reviewer"],"scenario":"staged_multifile"}],"logicalRoleRunsPerProfile":17,"minimumPairsForDirectionalClaim":20,"profiles":["role-separated-margin-only-v1","single-agent-margin-v1"],"repetitions":1,"rules":{"budgetUnit":"logical-role","meaningfulSpeedRatio":1.2,"qualityTolerancePoints":2.0,"singleAggregateScore":false},"sampleSizeSufficient":false,"scenarioIDs":["human_agent_relay","agent_agent_handoff","concurrent_review","suggestion_decision","staged_multifile","directory_handoff","parallel_shards","specialist_audit","distributed_synthesis"],"schema":"urn:marginbench:crossover-plan:v1","taskSet":"public-development-v1"}
